{
  "schemaVersion": "v1",
  "scenarioId": "desk_sol_composite_1",
  "title": "SOL composite desk scenario",
  "summary": "Composite spot, perp, prediction, and flash scenario staged through the harness.",
  "ownerUserId": "user_1",
  "strategyKey": "strategy_desk::sol_composite",
  "thesis": "Pair trend spot exposure with bounded perp hedge, event overlay, and flash rebalancing.",
  "sleeveId": "sleeve_1",
  "state": "paper_ready",
  "createdAt": "2026-03-17T03:00:00Z",
  "updatedAt": "2026-03-17T03:05:00Z",
  "reviewedAt": "2026-03-17T03:06:00Z",
  "latestReportId": "desk_report_sol_composite_paper_1",
  "legs": [
    {
      "legId": "leg_spot_alpha",
      "label": "Spot alpha",
      "role": "primary_alpha",
      "venueKey": "jupiter",
      "intentFamily": "spot_swap",
      "marketType": "spot",
      "pair": {
        "symbol": "SOL/USDC",
        "baseMint": "So11111111111111111111111111111111111111112",
        "quoteMint": "EPjFWdd5AufqSSqeM2qN1xzybapC8G4wEGGkZwyTDt1v",
        "marketType": "spot"
      },
      "assetKeys": ["SOL", "USDC"],
      "enabledModes": ["shadow", "paper", "live"],
      "sizing": {
        "targetNotionalUsd": "1000",
        "maxNotionalUsd": "2500",
        "reserveUsd": "1000",
        "maxSlippageBps": 50
      },
      "thesis": "Primary directional spot leg.",
      "tags": ["alpha", "spot"]
    },
    {
      "legId": "leg_perp_hedge",
      "label": "Perp hedge",
      "role": "hedge",
      "venueKey": "drift",
      "intentFamily": "perp_order",
      "marketType": "perp",
      "pair": {
        "symbol": "SOL-PERP",
        "baseMint": "So11111111111111111111111111111111111111112",
        "quoteMint": "EPjFWdd5AufqSSqeM2qN1xzybapC8G4wEGGkZwyTDt1v",
        "marketType": "perp"
      },
      "instrumentId": "SOL-PERP",
      "assetKeys": ["SOL", "USDC"],
      "enabledModes": ["shadow", "paper"],
      "sizing": {
        "targetNotionalUsd": "500",
        "maxNotionalUsd": "750",
        "reserveUsd": "250",
        "maxSlippageBps": 30
      },
      "thesis": "Hedge spot beta when momentum weakens.",
      "dependencies": ["leg_spot_alpha"],
      "tags": ["hedge", "perp"]
    },
    {
      "legId": "leg_prediction_overlay",
      "label": "Prediction overlay",
      "role": "prediction",
      "venueKey": "dflow",
      "intentFamily": "prediction_order",
      "marketType": "spot",
      "instrumentId": "macro-fed-cut-jun-2026",
      "assetKeys": ["SOL", "USDC"],
      "enabledModes": ["shadow", "paper"],
      "sizing": {
        "targetNotionalUsd": "150",
        "maxNotionalUsd": "250",
        "reserveUsd": "100",
        "maxSlippageBps": 100
      },
      "thesis": "Event hedge for macro-sensitive weeks.",
      "tags": ["overlay", "prediction"]
    },
    {
      "legId": "leg_flash_rebalance",
      "label": "Flash rebalance",
      "role": "flash_rebalance",
      "venueKey": "flash_liquidity",
      "intentFamily": "flash_atomic",
      "marketType": "spot",
      "pair": {
        "symbol": "SOL/USDC",
        "baseMint": "So11111111111111111111111111111111111111112",
        "quoteMint": "EPjFWdd5AufqSSqeM2qN1xzybapC8G4wEGGkZwyTDt1v",
        "marketType": "spot"
      },
      "assetKeys": ["SOL", "USDC"],
      "enabledModes": ["shadow", "paper"],
      "sizing": {
        "targetNotionalUsd": "250",
        "maxNotionalUsd": "500",
        "reserveUsd": "125",
        "maxSlippageBps": 35
      },
      "thesis": "Atomic rebalance path for bounded inventory clean-up.",
      "dependencies": ["leg_spot_alpha", "leg_perp_hedge"],
      "tags": ["flash", "rebalance"]
    }
  ],
  "evidence": [
    {
      "stage": "backtest",
      "summary": "Walk-forward backtest bundle for the composite thesis.",
      "evidenceRefs": [
        {
          "kind": "backtest_report",
          "ref": "backtest_alloc_dca_report"
        }
      ]
    },
    {
      "stage": "paper",
      "summary": "Composite paper report and leg receipts.",
      "evidenceRefs": [
        {
          "kind": "strategy_desk_report",
          "ref": "desk_report_sol_composite_paper_1"
        }
      ],
      "latestReportId": "desk_report_sol_composite_paper_1"
    }
  ],
  "implementationReferences": [
    {
      "kind": "issue",
      "ref": "#436",
      "notes": "Contract-first strategy desk rollout."
    }
  ],
  "tags": ["strategy-desk", "composite"]
}
